<?xml version="1.0" encoding="UTF-8"?>

<event
	xmlns:xsd="http://www.w3.org/2001/XMLSchema"
	xmlns:xsi="http://www.w3.org/2001/XMLSchema-instance"
	xsi:noNamespaceSchemaLocation="../XSD/Event.xsd"
	userID="26" eventID="109">
	
	<eventName>Etar - PFC Ludogorets Razgrad (Bulgaria - A Grupa)</eventName>
	<eventTitle>Holly's Awesome Live Ticker</eventTitle>
	<eventDescription>Live from Bulgaria Holly is going to rock the socks!! Join the show!</eventDescription>
	<eventAdmin>
		<username>Holly998</username>
	</eventAdmin>
	<eventType>Football</eventType>
	<eventStart>2013-05-12T08:45:00+02:00</eventStart>
	<eventDuration>PT110M</eventDuration>
	<eventRate>4</eventRate>
	
	</event>